{"format":"metoceanviewer-stations","version":"1.0","provider":"usgs",
 "generated":"2026-10-15T12:00:00Z",
 "sources":[{"url":"https://api.waterdata.usgs.gov/ogcapi/v0/collections/combined-metadata/items","retrieved":"2026-10-15T11:58:03Z"}],
 "stations":[
{"id":"USGS-07010000","name":"MISSISSIPPI RIVER AT ST. LOUIS, MO","lon":-90.1796,"lat":38.629,"first":"2007-10-01","usgs":{"series":[{"id":"0a8e2a0f6ad94e2a9e0e3a3b3c3d3e3f","parameter":"00065","statistic":"00011","parameter_name":"Gage height, feet","primary":true,"unit":"ft","first":"2007-10-01"},{"id":"1b2c3d4e5f60718293a4b5c6d7e8f901","parameter":"00060","statistic":"00011","parameter_name":"Discharge, cubic feet per second","primary":true,"unit":"ft3 s-1","first":"2007-10-01","last":"2025-09-30"}]}},
{"id":"USGS-295501090190400","name":"","lon":-90.317778,"lat":29.916944,"usgs":{"series":[{"id":"ffffffffffffffffffffffffffffffff","parameter":"62620","statistic":"00011"}]}}
]}
