{"format":"metoceanviewer-stations","version":"1.0","provider":"usgs",
 "generated":"2026-10-15T17:00:00Z",
 "sources":[],
 "stations":[
{"id":"USGS-07010000","name":"MISSISSIPPI RIVER AT ST. LOUIS, MO","lon":-90.1796,"lat":38.629,"usgs":{"series":[{"id":"1b2c3d4e5f60718293a4b5c6d7e8f901","parameter":"00060","statistic":"00011","primary":true},{"id":"2b2c3d4e5f60718293a4b5c6d7e8f901","parameter":"00060","statistic":"00011","primary":true}]}}
]}
