{"format":"metoceanviewer-stations","version":"1.0","provider":"noaa_coops",
 "generated":"2026-10-15T17:00:00Z",
 "sources":[],
 "stations":[
{"id":"8729840","name":"Pensacola","lon":-87.2112,"lat":30.4044,"coops":{}},
{"id":"8729840","name":"Pensacola","lon":-87.2112,"lat":30.4044,"coops":{"air_gap":true}}
]}
